{
  "days": {
    "2026-10-22": {
      "catalogVersion": "2026-10-22.06c420d9",
      "musica": {
        "dificil": [
          {
            "answer": "apple:tr:6782046124"
          },
          {
            "answer": "apple:tr:385700725"
          },
          {
            "answer": "apple:tr:6811918500"
          }
        ],
        "facil": [
          {
            "answer": "apple:tr:1566508411"
          },
          {
            "answer": "apple:tr:1718526128"
          },
          {
            "answer": "apple:tr:1536103707"
          }
        ],
        "medio": [
          {
            "answer": "apple:tr:872398792"
          },
          {
            "answer": "apple:tr:1536379052"
          },
          {
            "answer": "apple:tr:1536257480"
          }
        ]
      },
      "number": 1,
      "titulo": {
        "dificil": [
          {
            "answer": "apple:tr:1537251751"
          },
          {
            "answer": "apple:tr:733755431"
          },
          {
            "answer": "apple:tr:1348203258"
          }
        ],
        "facil": [
          {
            "answer": "apple:tr:1745664499"
          },
          {
            "answer": "apple:tr:1536140851"
          },
          {
            "answer": "apple:tr:1683295726"
          }
        ],
        "medio": [
          {
            "answer": "apple:tr:1746904286"
          },
          {
            "answer": "apple:tr:1537229545"
          },
          {
            "answer": "apple:tr:1537381961"
          }
        ]
      }
    },
    "2026-10-23": {
      "catalogVersion": "2026-10-22.06c420d9",
      "musica": {
        "dificil": [
          {
            "answer": "apple:tr:1321724273"
          },
          {
            "answer": "apple:tr:1358216076"
          },
          {
            "answer": "apple:tr:1358216053"
          }
        ],
        "facil": [
          {
            "answer": "apple:tr:1537452458"
          },
          {
            "answer": "apple:tr:1297260555"
          },
          {
            "answer": "apple:tr:1517995045"
          }
        ],
        "medio": [
          {
            "answer": "apple:tr:1536489974"
          },
          {
            "answer": "apple:tr:1534682707"
          },
          {
            "answer": "apple:tr:1358216084"
          }
        ]
      },
      "number": 2,
      "titulo": {
        "dificil": [
          {
            "answer": "apple:tr:1209335639"
          },
          {
            "answer": "apple:tr:1481330732"
          },
          {
            "answer": "apple:tr:864764609"
          }
        ],
        "facil": [
          {
            "answer": "apple:tr:1536271840"
          },
          {
            "answer": "apple:tr:1537381402"
          },
          {
            "answer": "apple:tr:961856558"
          }
        ],
        "medio": [
          {
            "answer": "apple:tr:1719724057"
          },
          {
            "answer": "apple:tr:1339054160"
          },
          {
            "answer": "apple:tr:1888448160"
          }
        ]
      }
    },
    "2026-10-24": {
      "catalogVersion": "2026-10-22.cdfb973a",
      "musica": {
        "dificil": [
          {
            "answer": "apple:tr:638086929"
          },
          {
            "answer": "apple:tr:1526095124"
          },
          {
            "answer": "apple:tr:1726312196"
          }
        ],
        "facil": [
          {
            "answer": "apple:tr:1562122319"
          },
          {
            "answer": "apple:tr:1536273244"
          },
          {
            "answer": "apple:tr:1537419724"
          }
        ],
        "medio": [
          {
            "answer": "apple:tr:1537291898"
          },
          {
            "answer": "apple:tr:1804659322"
          },
          {
            "answer": "apple:tr:1754058199"
          }
        ]
      },
      "number": 3,
      "titulo": {
        "dificil": [
          {
            "answer": "apple:tr:1725058791"
          },
          {
            "answer": "apple:tr:1661725722"
          },
          {
            "answer": "apple:tr:1692341508"
          }
        ],
        "facil": [
          {
            "answer": "apple:tr:1525498908"
          },
          {
            "answer": "apple:tr:1815243485"
          },
          {
            "answer": "apple:tr:1536371431"
          }
        ],
        "medio": [
          {
            "answer": "apple:tr:1573852763"
          },
          {
            "answer": "apple:tr:1826645213"
          },
          {
            "answer": "apple:tr:1282835109"
          }
        ]
      }
    },
    "2026-10-25": {
      "catalogVersion": "2026-10-22.cdfb973a",
      "musica": {
        "dificil": [
          {
            "answer": "apple:tr:1333849728"
          },
          {
            "answer": "apple:tr:1695684207"
          },
          {
            "answer": "apple:tr:1204216484"
          }
        ],
        "facil": [
          {
            "answer": "apple:tr:1548308058"
          },
          {
            "answer": "apple:tr:1229977150"
          },
          {
            "answer": "apple:tr:1140022697"
          }
        ],
        "medio": [
          {
            "answer": "apple:tr:1688986835"
          },
          {
            "answer": "apple:tr:1537249926"
          },
          {
            "answer": "apple:tr:567942245"
          }
        ]
      },
      "number": 4,
      "titulo": {
        "dificil": [
          {
            "answer": "apple:tr:1137878647"
          },
          {
            "answer": "apple:tr:1538259691"
          },
          {
            "answer": "apple:tr:1560104538"
          }
        ],
        "facil": [
          {
            "answer": "apple:tr:1536116908"
          },
          {
            "answer": "apple:tr:1535535911"
          },
          {
            "answer": "apple:tr:1644816114"
          }
        ],
        "medio": [
          {
            "answer": "apple:tr:1638701929"
          },
          {
            "answer": "apple:tr:1748963164"
          },
          {
            "answer": "apple:tr:730903332"
          }
        ]
      }
    },
    "2026-10-26": {
      "catalogVersion": "2026-10-22.cdfb973a",
      "musica": {
        "dificil": [
          {
            "answer": "apple:tr:1605735698"
          },
          {
            "answer": "apple:tr:472927960"
          },
          {
            "answer": "apple:tr:1483941722"
          }
        ],
        "facil": [
          {
            "answer": "apple:tr:1536371821"
          },
          {
            "answer": "apple:tr:1614420885"
          },
          {
            "answer": "apple:tr:1537901887"
          }
        ],
        "medio": [
          {
            "answer": "apple:tr:1777983027"
          },
          {
            "answer": "apple:tr:1485215965"
          },
          {
            "answer": "apple:tr:722733980"
          }
        ]
      },
      "number": 5,
      "titulo": {
        "dificil": [
          {
            "answer": "apple:tr:1886349450"
          },
          {
            "answer": "apple:tr:1549545979"
          },
          {
            "answer": "apple:tr:1804674272"
          }
        ],
        "facil": [
          {
            "answer": "apple:tr:1469518211"
          },
          {
            "answer": "apple:tr:1077263357"
          },
          {
            "answer": "apple:tr:1837658529"
          }
        ],
        "medio": [
          {
            "answer": "apple:tr:1801630569"
          },
          {
            "answer": "apple:tr:1128261202"
          },
          {
            "answer": "apple:tr:1753840462"
          }
        ]
      }
    },
    "2026-10-27": {
      "catalogVersion": "2026-10-22.cdfb973a",
      "musica": {
        "dificil": [
          {
            "answer": "apple:tr:1387424555"
          },
          {
            "answer": "apple:tr:1538285501"
          },
          {
            "answer": "apple:tr:1538109175"
          }
        ],
        "facil": [
          {
            "answer": "apple:tr:1133869639"
          },
          {
            "answer": "apple:tr:1600223385"
          },
          {
            "answer": "apple:tr:1471459432"
          }
        ],
        "medio": [
          {
            "answer": "apple:tr:1558875124"
          },
          {
            "answer": "apple:tr:1469495353"
          },
          {
            "answer": "apple:tr:743662411"
          }
        ]
      },
      "number": 6,
      "titulo": {
        "dificil": [
          {
            "answer": "apple:tr:1441281837"
          },
          {
            "answer": "apple:tr:1740516594"
          },
          {
            "answer": "apple:tr:1548677745"
          }
        ],
        "facil": [
          {
            "answer": "apple:tr:1573750699"
          },
          {
            "answer": "apple:tr:1436176364"
          },
          {
            "answer": "apple:tr:1573359701"
          }
        ],
        "medio": [
          {
            "answer": "apple:tr:1693743422"
          },
          {
            "answer": "apple:tr:1889741674"
          },
          {
            "answer": "apple:tr:1096953201"
          }
        ]
      }
    },
    "2026-10-28": {
      "catalogVersion": "2026-10-22.cdfb973a",
      "musica": {
        "dificil": [
          {
            "answer": "apple:tr:1613475860"
          },
          {
            "answer": "apple:tr:1098475108"
          },
          {
            "answer": "apple:tr:1891247381"
          }
        ],
        "facil": [
          {
            "answer": "apple:tr:1707331779"
          },
          {
            "answer": "apple:tr:1562780431"
          },
          {
            "answer": "apple:tr:637426727"
          }
        ],
        "medio": [
          {